{
    "type": "object",
    "$schema": "http://json-schema.org/draft-04/schema",
    "properties": {
         "plan": {
            "type": "object",
            "properties": {
                "$ref": "http://local.com/common_models#/properties/cda_coded_entry"
            }
        },
        "type": {
            "type": "string"
        },
        "date_time": {
            "$ref": "http://local.com/common_models#/properties/cda_date"
        },
        "identifiers": {
            "type": "array",
            "items": {
                "$ref": "http://local.com/common_models#/properties/cda_id"
            },
            "minItems": 1
        }
    },
    "required": [
        "plan"
    ],
    "additionalProperties": false
}